Form Number,Form Title,Form URL
28-A,Order of Foreign Adoption and Name Change,https://www.nycourts.gov/forms/order-foreign-adoption-and-name-change?topic=611&wrapped=true
358-a-5,Order of Disposition - Petition for Approval of an Instrument,https://www.nycourts.gov/forms/order-disposition-petition-approval-instrument?topic=611&wrapped=true
358-a-7,Order of Disposition - Petition for Pre-placement approval of Standby Placement Instrument,https://www.nycourts.gov/forms/order-disposition-petition-pre-placement-approval-standby-placement-instrument?topic=611&wrapped=true
CRIM-1,Order of Protection/Family Offense (Criminal Courts),https://www.nycourts.gov/forms/order-protectionfamily-offense-criminal-courts?topic=611&wrapped=true
CRIM-2,Order of Protection/Non-Family Offense (Criminal Courts),https://www.nycourts.gov/forms/order-protectionnon-family-offense-criminal-courts?topic=611&wrapped=true
GF-1,Order to Show Cause,https://www.nycourts.gov/forms/order-show-cause?topic=611&wrapped=true
GF-5a,Order of Protection (Family Court),https://www.nycourts.gov/forms/order-protection-family-court?topic=611&wrapped=true
GF-6a,Order of Protection (Person in Need of Supervision or Juvenile Delinquency),https://www.nycourts.gov/forms/order-protection-person-need-supervision-or-juvenile-delinquency?topic=611&wrapped=true
GF-8,Petition - Violation of Order of Protection,https://www.nycourts.gov/forms/petition-violation-order-protection?topic=611&wrapped=true
GF-8a (on web Petition (Violation of Court Order),Petition - Violation of an Order,https://www.nycourts.gov/forms/petition-violation-order?topic=611&wrapped=true
GF-11,Order of Commitment,https://www.nycourts.gov/forms/order-commitment?topic=611&wrapped=true
GF-15,Order on Motion,https://www.nycourts.gov/forms/order-motion?topic=611&wrapped=true
GF-18,Order of Custody/Visitation,https://www.nycourts.gov/forms/order-custodyvisitation?topic=611&wrapped=true
GF-18a,Order on Motion for Sibling Placement or Contact,https://www.nycourts.gov/forms/order-motion-sibling-placement-or-contact?topic=611&wrapped=true
GF-20,Order of Transfer of Proceeding Concerning an Indian Child,https://www.nycourts.gov/forms/order-transfer-proceeding-concerning-indian-child?topic=611&wrapped=true
GF-24,Order to Sheriff to Return Respondent,https://www.nycourts.gov/forms/order-sheriff-return-respondent?topic=611&wrapped=true
GF-25,Order Suspending Commitment,https://www.nycourts.gov/forms/order-suspending-commitment?topic=611&wrapped=true
GF-37,Order on Motion For An Order That Reasonable Efforts Are Not Required,https://www.nycourts.gov/forms/order-motion-order-reasonable-efforts-are-not-required?topic=611&wrapped=true
GF-40a,Order on Petition for Modification of Custody/Visitation Order Made by Supreme or Family Court,https://www.nycourts.gov/forms/order-petition-modification-custodyvisitation-order-made-supreme-or-family-court?topic=611&wrapped=true
GF-40a,Order On Petition For Modification Of Order Of Custody visitation,https://www.nycourts.gov/forms/order-petition-modification-order-custody-visitation?topic=611&wrapped=true
GF-41a,Order On Petition For Enforcement Of Order Of Custody visitation,https://www.nycourts.gov/forms/order-petition-enforcement-order-custody-visitation?topic=611&wrapped=true
GF-41a,Order on Petition to Enforce Cust/Vis Order Made by Supreme or Family Court,https://www.nycourts.gov/forms/order-petition-enforce-custvis-order-made-supreme-or-family-court?topic=611&wrapped=true
GF-44,Order on Petition for Voter Registration Confidentiality,https://www.nycourts.gov/forms/order-petition-voter-registration-confidentiality?topic=611&wrapped=true
GF-47,Order of Name-change on Consent,https://www.nycourts.gov/forms/order-name-change-consent?topic=611&wrapped=true
PH-2,Permanency Report (Multiple Children),https://www.nycourts.gov/forms/permanency-report-multiple-children?topic=611&wrapped=true
PH-3,Permanency Report (Child Freed for Adoption),https://www.nycourts.gov/forms/permanency-report-child-freed-adoption?topic=611&wrapped=true
PH-7,Order to Show Cause (Reentry into Foster Care),https://www.nycourts.gov/forms/order-show-cause-reentry-foster-care?topic=611&wrapped=true
PH-8,Order on Motion to Reenter Foster Care,https://www.nycourts.gov/forms/order-motion-reenter-foster-care?topic=611&wrapped=true
SC-2,Order of Protection (Supreme Court),https://www.nycourts.gov/forms/order-protection-supreme-court?topic=611&wrapped=true
TPR-1,Petition (Permanent Neglect),https://www.nycourts.gov/forms/petition-permanent-neglect?topic=611&wrapped=true
TPR-2,Order of Disposition (Permanent Neglect),https://www.nycourts.gov/forms/order-disposition-permanent-neglect?topic=611&wrapped=true
TPR-4,Petition (Parents Deceased),https://www.nycourts.gov/forms/petition-parents-deceased?topic=611&wrapped=true
TPR-5,Order of Disposition (Parents Deceased),https://www.nycourts.gov/forms/order-disposition-parents-deceased?topic=611&wrapped=true
TPR-6,Petition (Abandonment),https://www.nycourts.gov/forms/petition-abandonment?topic=611&wrapped=true
TPR-7,Order of Disposition (Abandonment),https://www.nycourts.gov/forms/order-disposition-abandonment?topic=611&wrapped=true
TPR-8,Petition (Mental Illness or Intellectual Disability of Parents),https://www.nycourts.gov/forms/petition-mental-illness-or-intellectual-disability-parents?topic=611&wrapped=true
TPR-9,Order of Disposition (Mental Illness or Intellectual Disability) of Parents,https://www.nycourts.gov/forms/order-disposition-mental-illness-or-intellectual-disability-parents?topic=611&wrapped=true
TPR-10,Petition (Severely or Repeatedly Abused Child),https://www.nycourts.gov/forms/petition-severely-or-repeatedly-abused-child?topic=611&wrapped=true
TPR-11,Order of Disposition (Severely or Repeatedly Abused Child),https://www.nycourts.gov/forms/order-disposition-severely-or-repeatedly-abused-child?topic=611&wrapped=true
TPR-16,Order on Petition to Restore Parental Rights,https://www.nycourts.gov/forms/order-petition-restore-parental-rights?topic=611&wrapped=true
UCCJEA-2,Order on Petition for Custody/Visitation - UCCJEA,https://www.nycourts.gov/forms/order-petition-custodyvisitation-uccjea?topic=611&wrapped=true
UCCJEA-4a,Order to Show Cause - UCCJEA-Notice,https://www.nycourts.gov/forms/order-show-cause-uccjea-notice?topic=611&wrapped=true
UCCJEA-7a,Order on Electronic Testimony Application,https://www.nycourts.gov/forms/order-electronic-testimony-application?topic=611&wrapped=true
UCCJEA-10,Order on Petition to Modify Order of Custody/Visitation - UCCJEA,https://www.nycourts.gov/forms/order-petition-modify-order-custodyvisitation-uccjea?topic=611&wrapped=true
UCCJEA-12,Order to Appear on Petition to Enforce Custody/Visitation Order - UCCJEA,https://www.nycourts.gov/forms/order-appear-petition-enforce-custodyvisitation-order-uccjea?topic=611&wrapped=true
UCCJEA-13,Order on Petition to Enforce Order of Custody/Visitation - UCCJEA,https://www.nycourts.gov/forms/order-petition-enforce-order-custodyvisitation-uccjea?topic=611&wrapped=true
UIFSA-13,Order on Petition to Vacate Registration of Out-of-State Support Order,https://www.nycourts.gov/forms/order-petition-vacate-registration-out-state-support-order?topic=611&wrapped=true
UIFSA-15,Personal Information Form for UIFSA § 311,https://www.nycourts.gov/forms/personal-information-form-uifsa-ss-311?topic=611&wrapped=true
--,Order to Terminate or Sever Lease (Criminal),https://www.nycourts.gov/forms/order-terminate-or-sever-lease-criminal?topic=611&wrapped=true
1-A,Petition For Adoption (Agency),https://www.nycourts.gov/forms/petition-adoption-agency?topic=611&wrapped=true
1-B,Verified Schedule (Agency),https://www.nycourts.gov/forms/verified-schedule-agency?topic=611&wrapped=true
1-C,Petition for Adoption (Private Placement),https://www.nycourts.gov/forms/petition-adoption-private-placement?topic=611&wrapped=true
3-22,Petition for Dismissal for Continuing Lack of Capacity,https://www.nycourts.gov/forms/petition-dismissal-continuing-lack-capacity?topic=611&wrapped=true
3-24,Petition for Modification of Order of Commitment,https://www.nycourts.gov/forms/petition-modification-order-commitment?topic=611&wrapped=true
3-26,Petition to Determine Capacity After Prior Commitment,https://www.nycourts.gov/forms/petition-determine-capacity-after-prior-commitment?topic=611&wrapped=true
3-40,Petition for Violation of Order of Probation or Conditional Discharge,https://www.nycourts.gov/forms/petition-violation-order-probation-or-conditional-discharge?topic=611&wrapped=true
4-1,Petition for An Order Upon Support Agreement,https://www.nycourts.gov/forms/petition-order-upon-support-agreement?topic=611&wrapped=true
4-1a,Summons - Support,https://www.nycourts.gov/forms/summons-support?topic=611&wrapped=true
4-1b,Summons - Support (Non-Resident),https://www.nycourts.gov/forms/summons-support-non-resident?topic=611&wrapped=true
4-1b,Summons (Non-Resident),https://www.nycourts.gov/forms/summons-non-resident?topic=611&wrapped=true
4-3,Spousal (Only) Support Petition (spousal only),https://www.nycourts.gov/forms/spousal-only-support-petition-spousal-only?topic=611&wrapped=true
4-3c,Petition for Support of Adult Dependent,https://www.nycourts.gov/forms/petition-support-adult-dependent?topic=611&wrapped=true
4-4,Remand Commitment (Undertaking),https://www.nycourts.gov/forms/remand-commitment-undertaking?topic=611&wrapped=true
4-5a,Undertaking for Support - Cash Deposit,https://www.nycourts.gov/forms/undertaking-support-cash-deposit?topic=611&wrapped=true
4-7c,Rebuttal to Objection to Support Order,https://www.nycourts.gov/forms/rebuttal-objection-support-order-0?topic=611&wrapped=true
4-11,Petition for Modification of an Order of Support,https://www.nycourts.gov/forms/petition-modification-order-support?topic=611&wrapped=true
4-11 DSS,Support Modification against DSS,https://www.nycourts.gov/forms/support-modification-against-dss?topic=611&wrapped=true
4-12,Petition (Violation of Support Order),https://www.nycourts.gov/forms/petition-violation-support-order-0?topic=611&wrapped=true
4-12/13,Support Enforcement/Violation Petition,https://www.nycourts.gov/forms/support-enforcementviolation-petition?topic=611&wrapped=true
4-12a-1,Summons - Violation of Support Order,https://www.nycourts.gov/forms/summons-violation-support-order?topic=611&wrapped=true
4-12a-2,Summons - Violation of a Support Order (Non-Resident),https://www.nycourts.gov/forms/summons-violation-support-order-non-resident?topic=611&wrapped=true
4-12a-2,Summons (Violation of Support Order) (Non-Resident),https://www.nycourts.gov/forms/summons-violation-support-order-non-resident-0?topic=611&wrapped=true
4-13,Petition for Enforcement of an Order,https://www.nycourts.gov/forms/petition-enforcement-order?topic=611&wrapped=true
4-13,Petition for Enforcement of Order Made By Another Court (Support),https://www.nycourts.gov/forms/petition-enforcement-order-made-another-court-support?topic=611&wrapped=true
4-15,Petition for Relief from Support Payments and Commitment,https://www.nycourts.gov/forms/petition-relief-support-payments-and-commitment?topic=611&wrapped=true
4-18,Petition for Support After Acknowledgment of Parentage (Individual),https://www.nycourts.gov/forms/petition-support-after-acknowledgment-parentage-individual?topic=611&wrapped=true
4-18,Petition for Support After Acknowledgment of Paternity (Individual),https://www.nycourts.gov/forms/petition-support-after-acknowledgment-paternity-individual?topic=611&wrapped=true
4-18a,Petition for Support After Acknowledgment of Parentage (Commissioner),https://www.nycourts.gov/forms/petition-support-after-acknowledgment-parentage-commissioner?topic=611&wrapped=true
4-18a,Petition for Support After Acknowledgment of Paternity (Commissioner),https://www.nycourts.gov/forms/petition-support-after-acknowledgment-paternity-commissioner?topic=611&wrapped=true
4-23,Qualified Domestic Relations Order,https://www.nycourts.gov/forms/qualified-domestic-relations-order?topic=611&wrapped=true
"4-24a, 5-16a, UIFSA-10","Support, Paternity, UIFSA - Order on Electronic Testimony Application",https://www.nycourts.gov/forms/support-paternity-uifsa-order-electronic-testimony-application?topic=611&wrapped=true
4-SM-1,Stipulation for Child Support,https://www.nycourts.gov/forms/stipulation-child-support?topic=611&wrapped=true
5-1-a,Summons - Paternity,https://www.nycourts.gov/forms/summons-paternity?topic=611&wrapped=true
5-1-c,Summons - Paternity (Non-Resident),https://www.nycourts.gov/forms/summons-paternity-non-resident?topic=611&wrapped=true
5-1b,Summons - Paternity (Non-Party Spouse or Former Spouse),https://www.nycourts.gov/forms/summons-paternity-non-party-spouse-or-former-spouse?topic=611&wrapped=true
5-9,Remand Commitment (Undertaking) - Paternity,https://www.nycourts.gov/forms/remand-commitment-undertaking-paternity?topic=611&wrapped=true
5-15,Petition to Vacate Acknowledgment of Paternity,https://www.nycourts.gov/forms/petition-vacate-acknowledgment-paternity?topic=611&wrapped=true
5-C-5,Summons (Surrogacy Agreement or Assisted Reproduction),https://www.nycourts.gov/forms/summons-surrogacy-agreement-or-assisted-reproduction?topic=611&wrapped=true
5-C-6,Report of Birth of Child,https://www.nycourts.gov/forms/report-birth-child?topic=611&wrapped=true
6-1,Petition for Appointment As Guardian of a Person Or Permanent Guardian,https://www.nycourts.gov/forms/petition-appointment-guardian-person-or-permanent-guardian?topic=611&wrapped=true
6-1-a,Petition by Person Over 14 for Appointment of Guardian of a Person or Permanent Guardian,https://www.nycourts.gov/forms/petition-person-over-14-appointment-guardian-person-or-permanent-guardian?topic=611&wrapped=true
6-1-b,Petition by Person on Behalf of Person Under 21 for Appointment of Guardian of a Person or Permanent Guardian,https://www.nycourts.gov/forms/petition-person-behalf-person-under-21-appointment-guardian-person-or-permanent-guardian?topic=611&wrapped=true
6-1-c,Petition for Appointment of Kinship Guardian [Subsidized Kinship Guardian Program] and/or Permanent Guardian,https://www.nycourts.gov/forms/petition-appointment-kinship-guardian-subsidized-kinship-guardian-program-andor-permanent?topic=611&wrapped=true
6-3,Preference of Minor Over 14 Years of Age,https://www.nycourts.gov/forms/preference-minor-over-14-years-age?topic=611&wrapped=true
6-4,"Waiver of Process, Renunciation Or Consent to (Letters of Guardianship) (Standby Guardianship)",https://www.nycourts.gov/forms/waiver-process-renunciation-or-consent-letters-guardianship-standby-guardianship?topic=611&wrapped=true
6-4,"Waiver of Process, Renunciation or Consent to Letters of Guardianship/Standby Guardianship",https://www.nycourts.gov/forms/waiver-process-renunciation-or-consent-letters-guardianshipstandby-guardianship?topic=611&wrapped=true
7,Report of Investigation (Private Placement),https://www.nycourts.gov/forms/report-investigation-private-placement?topic=611&wrapped=true
7-1,Recognizance to Produce Child,https://www.nycourts.gov/forms/recognizance-produce-child?topic=611&wrapped=true
7-1a,Warrant of Arrest (w/ aliases) (PINS),https://www.nycourts.gov/forms/warrant-arrest-w-aliases-pins?topic=611&wrapped=true
7-9,Petition for Termination of Placement,https://www.nycourts.gov/forms/petition-termination-placement?topic=611&wrapped=true
7-11,Petition for Discontinuance of Treatment,https://www.nycourts.gov/forms/petition-discontinuance-treatment?topic=611&wrapped=true
10-7a,Summons - Child Abuse,https://www.nycourts.gov/forms/summons-child-abuse?topic=611&wrapped=true
10-7b,Warrant (w/ aliases) - Child Abuse/Child Neglect,https://www.nycourts.gov/forms/warrant-w-aliases-child-abusechild-neglect?topic=611&wrapped=true
10-7c,Summons - Child Neglect,https://www.nycourts.gov/forms/summons-child-neglect?topic=611&wrapped=true
10-15,Petition For Release of Responsibility Under Order of Placement,https://www.nycourts.gov/forms/petition-release-responsibility-under-order-placement?topic=611&wrapped=true
10-27,Petition for Extension of Supervision,https://www.nycourts.gov/forms/petition-extension-supervision?topic=611&wrapped=true
10-A,Supplemental Affidavit (Agency),https://www.nycourts.gov/forms/supplemental-affidavit-agency?topic=611&wrapped=true
10-B,Supplemental Affidavit (Private Placement),https://www.nycourts.gov/forms/supplemental-affidavit-private-placement?topic=611&wrapped=true
17,Petition For Enforcement of Post-adoption Contact Agreement (after Adoption Finalization),https://www.nycourts.gov/forms/petition-enforcement-post-adoption-contact-agreement-after-adoption-finalization?topic=611&wrapped=true
21-A,Petition for Temporary Guardianship,https://www.nycourts.gov/forms/petition-temporary-guardianship?topic=611&wrapped=true
26,Petition for Extension of Expired Certification,https://www.nycourts.gov/forms/petition-extension-expired-certification?topic=611&wrapped=true
28,Petition for Registration of Foreign Adoption Order,https://www.nycourts.gov/forms/petition-registration-foreign-adoption-order?topic=611&wrapped=true
29a,Petition for Adult Adoption,https://www.nycourts.gov/forms/petition-adult-adoption?topic=611&wrapped=true
30,Petition For Access to Sealed Birth Certificate,https://www.nycourts.gov/forms/petition-access-sealed-birth-certificate?topic=611&wrapped=true
358-a-1,Petition for Approval of an Instrument,https://www.nycourts.gov/forms/petition-approval-instrument?topic=611&wrapped=true
358-a-4,Temporary Order Approving Placement Instrument,https://www.nycourts.gov/forms/temporary-order-approving-placement-instrument?topic=611&wrapped=true
358-a-6,Petition for Pre-placement Approval of Standby Placement Instrument,https://www.nycourts.gov/forms/petition-pre-placement-approval-standby-placement-instrument?topic=611&wrapped=true
DOH-1928,Report of Adoption (to be completed and certified by the court),https://www.nycourts.gov/forms/report-adoption-be-completed-and-certified-court?topic=611&wrapped=true
GF-2,Summons - General,https://www.nycourts.gov/forms/summons-general?topic=611&wrapped=true
GF-3,Warrant of Arrest,https://www.nycourts.gov/forms/warrant-arrest?topic=611&wrapped=true
GF-3 (On web Warrant of Arrest),Warrant of Arrest (w/ aliases),https://www.nycourts.gov/forms/warrant-arrest-w-aliases?topic=611&wrapped=true
GF-4,Subpoena Duces Tecum,https://www.nycourts.gov/forms/subpoena-duces-tecum?topic=611&wrapped=true
GF-5,Temporary Order of Protection (Family Court),https://www.nycourts.gov/forms/temporary-order-protection-family-court?topic=611&wrapped=true
GF-6,Temporary Order of Protection (Person in Need of Supervision or Juvenile Delinquency),https://www.nycourts.gov/forms/temporary-order-protection-person-need-supervision-or-juvenile-delinquency?topic=611&wrapped=true
GF-6,Temporary Order of Protection (Person in Need of Supervision or Juvenile Delinquency),https://www.nycourts.gov/forms/temporary-order-protection-person-need-supervision-or-juvenile-delinquency-0?topic=611&wrapped=true
GF-7,Summons - Violation of Order of Protection,https://www.nycourts.gov/forms/summons-violation-order-protection?topic=611&wrapped=true
GF-7a,Summons - Violation of Court Order,https://www.nycourts.gov/forms/summons-violation-court-order?topic=611&wrapped=true
GF-12-b,Protective Order - Self-represented party Prior to Receipt of Forensic Report,https://www.nycourts.gov/forms/protective-order-self-represented-party-prior-receipt-forensic-report?topic=611&wrapped=true
GF-12-c,Protective Order - After Forensic Report Received,https://www.nycourts.gov/forms/protective-order-after-forensic-report-received?topic=611&wrapped=true
GF-12-e,Protective Order Permitting Limited Release of Forensic Evaluation,https://www.nycourts.gov/forms/protective-order-permitting-limited-release-forensic-evaluation?topic=611&wrapped=true
GF-17,Petition for (Custody) (Visitation),https://www.nycourts.gov/forms/petition-custody-visitation?topic=611&wrapped=true
GF-17,Petition for Custody/Visitation,https://www.nycourts.gov/forms/petition-custodyvisitation?topic=611&wrapped=true
GF-22,Petition for Writ of Habeas Corpus,https://www.nycourts.gov/forms/petition-writ-habeas-corpus?topic=611&wrapped=true
GF-23,Writ of Habeas Corpus,https://www.nycourts.gov/forms/writ-habeas-corpus?topic=611&wrapped=true
GF-30,Summons (Publication),https://www.nycourts.gov/forms/summons-publication?topic=611&wrapped=true
GF-40,Petition for Modification of Custody/Visitation Order Made by Supreme or Family Court,https://www.nycourts.gov/forms/petition-modification-custodyvisitation-order-made-supreme-or-family-court?topic=611&wrapped=true
GF-40,Petition For Modification Of Order Of Custody Visitation,https://www.nycourts.gov/forms/petition-modification-order-custody-visitation?topic=611&wrapped=true
GF-41,Petition for Enforcement of Order of Custody or Visitation made by Supreme Court or Family Court,https://www.nycourts.gov/forms/petition-enforcement-order-custody-or-visitation-made-supreme-court-or-family-court?topic=611&wrapped=true
GF-42,Special Immigrant Juvenile Status - Order,https://www.nycourts.gov/forms/special-immigrant-juvenile-status-order?topic=611&wrapped=true
GF-42,Special Immigrant Juvenile Status Order,https://www.nycourts.gov/forms/special-immigrant-juvenile-status-order-0?topic=611&wrapped=true
GF-43,Petition for Voter Registration Confidentiality,https://www.nycourts.gov/forms/petition-voter-registration-confidentiality?topic=611&wrapped=true
GF19,Petition for Transfer of Proceeding Concerning an Indian Child,https://www.nycourts.gov/forms/petition-transfer-proceeding-concerning-indian-child?topic=611&wrapped=true
OCFS-3937,Request for Information - Private Adoption,https://www.nycourts.gov/forms/request-information-private-adoption?topic=611&wrapped=true
PH-4-b,Statement to Court of Permanency Hearing Reports and/or Notices Sent,https://www.nycourts.gov/forms/statement-court-permanency-hearing-reports-andor-notices-sent-0?topic=611&wrapped=true
PH-4a,Statement to Court of Permanency Hearing Reports and/or Notices Sent,https://www.nycourts.gov/forms/statement-court-permanency-hearing-reports-andor-notices-sent?topic=611&wrapped=true
PH-4c,Statement to Court of Permanency Hearing Reports and/or Notices Sent,https://www.nycourts.gov/forms/statement-court-permanency-hearing-reports-andor-notices-sent-1?topic=611&wrapped=true
SC-1,Temporary Order of Protection (Supreme Court),https://www.nycourts.gov/forms/temporary-order-protection-supreme-court?topic=611&wrapped=true
SURR-3,Petition for Approval of Extra-judicial Surrender Instrument,https://www.nycourts.gov/forms/petition-approval-extra-judicial-surrender-instrument?topic=611&wrapped=true
SURR-7,Petition for Review of Failure of Material Condition in Conditional Surrender and violation of Post-adoption Contact Agreement (Prior to Adoption Finalization),https://www.nycourts.gov/forms/petition-review-failure-material-condition-conditional-surrender-and-violation-post-adoption?topic=611&wrapped=true
TPR-1a,Summons - Termination of Parental Rights,https://www.nycourts.gov/forms/summons-termination-parental-rights?topic=611&wrapped=true
TPR-13,Termination of Parental Rights - Determination of Family Court Judge Regarding Venue,https://www.nycourts.gov/forms/termination-parental-rights-determination-family-court-judge-regarding-venue?topic=611&wrapped=true
TPR-14,Termination of Parental Right Order Regarding Venue,https://www.nycourts.gov/forms/termination-parental-right-order-regarding-venue?topic=611&wrapped=true
TPR-15,Petition to Restore Parental Rights,https://www.nycourts.gov/forms/petition-restore-parental-rights?topic=611&wrapped=true
UCCJEA-1,Petition for Custody/Visitation - UCCJEA,https://www.nycourts.gov/forms/petition-custodyvisitation-uccjea?topic=611&wrapped=true
UCCJEA-6,Warrant to Arrest Party and Take Physical Custody of Child - UCCJEA,https://www.nycourts.gov/forms/warrant-arrest-party-and-take-physical-custody-child-uccjea?topic=611&wrapped=true
UCCJEA-8,Request for Assistance or Records,https://www.nycourts.gov/forms/request-assistance-or-records?topic=611&wrapped=true
UCCJEA-9,Petition to Modify Custody/Visitation Order - UCCJEA,https://www.nycourts.gov/forms/petition-modify-custodyvisitation-order-uccjea?topic=611&wrapped=true
UCCJEA-11,Petition to Enforce Custody/Visitation Order - UCCJEA,https://www.nycourts.gov/forms/petition-enforce-custodyvisitation-order-uccjea?topic=611&wrapped=true
UCS-836,Uniform Adoption - Attorney's Affidavit (Agency and Private Placement),https://www.nycourts.gov/forms/uniform-adoption-attorneys-affidavit-agency-and-private-placement?topic=611&wrapped=true
UIFSA-4,Uniform Support Petition,https://www.nycourts.gov/forms/uniform-support-petition?topic=611&wrapped=true
UIFSA-9,Registration Statement,https://www.nycourts.gov/forms/registration-statement?topic=611&wrapped=true
UIFSA-12,Petition to Vacate Registration of Out-of-State Support Order,https://www.nycourts.gov/forms/petition-vacate-registration-out-state-support-order?topic=611&wrapped=true
--,Withdrawal Request,https://www.nycourts.gov/forms/withdrawal-request?topic=611&wrapped=true
